{
  "schema_version": "1.0",
  "task_id": "T015",
  "event_id": "evt-approval-granted-001",
  "run_id": "run-T015-001",
  "parent_event_id": "evt-tool-call-requested-001",
  "idempotency_key": "idem-run-T015-001-approval-granted",
  "correlation_id": "corr-run-T015-001",
  "event_type": "approval_granted",
  "risk_level": "high",
  "occurred_at": "2026-05-22T12:01:00.000Z",
  "source": {
    "kind": "worker",
    "name": "agent-ledger-runtime-dev",
    "version": "0.1.0",
    "environment": "dev"
  },
  "payload_metadata_json": {
    "kind": "approval_metadata",
    "summary": "Human approval granted after a local review of a high-risk action.",
    "labels": ["approval", "human-review", "metadata-only"],
    "counts": {
      "approvals": 1
    },
    "contains_sensitive_data": false,
    "references": ["event:evt-tool-call-requested-001"]
  },
  "redaction": {
    "policy": "redacted_summary",
    "applied": true,
    "raw_prompt_captured": false,
    "raw_customer_data_captured": false,
    "raw_secret_captured": false,
    "fields_redacted": ["prompt", "policy_notes"],
    "notes": "Approval record stores only redacted metadata."
  }
}
